{
  "schema_version": "1.0",
  "scanner_version": "0.1.0rc2",
  "ruleset_version": "r1-1",
  "scan_id": "1f5ccd69-6e99-49de-b36b-8727f7c18a52",
  "started_at": "2026-10-14T13:22:25.689182+00:00",
  "finished_at": "2026-10-14T13:22:25.690380+00:00",
  "target": "https://example.org/",
  "scope": {
    "hosts": [
      "example.org"
    ],
    "mode": "http-static"
  },
  "config": {
    "target": "https://example.org/",
    "max_pages": 30,
    "max_depth": 2,
    "max_requests": 100,
    "time_limit": 300,
    "timeout": 10,
    "max_redirects": 5,
    "html_limit": 2097152,
    "document_limit": 5242880,
    "byte_limit": 26214400,
    "interval": 1.0,
    "allow_hosts": [],
    "exclude_paths": [],
    "check_external_docs": false
  },
  "scan_status": "partial",
  "color": "yellow",
  "checks": [
    {
      "rule_id": "C01",
      "machine_key": "protocol-page-v1",
      "url": "https://example.org/",
      "outcome": "pass",
      "object_kind": "page",
      "message": "Техническое условие проверено; дефект не обнаружен.",
      "reason_code": "pass",
      "evidence_refs": [
        "9a46a9671fdfa7809d5c5fe677fd723959d59877944617395af3d57db60ebd5f",
        "b9460e0c85b27fe462996e2d309d056b349b29fec4bf0e8e55cb3f4fcbaeea76"
      ]
    },
    {
      "rule_id": "C02",
      "machine_key": "tls-certificate-v1",
      "url": "https://example.org/",
      "outcome": "pass",
      "object_kind": "page",
      "message": "Техническое условие проверено; дефект не обнаружен.",
      "reason_code": "pass",
      "evidence_refs": [
        "9a46a9671fdfa7809d5c5fe677fd723959d59877944617395af3d57db60ebd5f",
        "b9460e0c85b27fe462996e2d309d056b349b29fec4bf0e8e55cb3f4fcbaeea76"
      ]
    },
    {
      "rule_id": "C03",
      "machine_key": "document-status-v1",
      "url": "https://example.org/",
      "outcome": "not_applicable",
      "object_kind": "page",
      "message": "Нет объекта для этого правила в обследованном ответе.",
      "reason_code": "not_applicable",
      "evidence_refs": [
        "9a46a9671fdfa7809d5c5fe677fd723959d59877944617395af3d57db60ebd5f",
        "b9460e0c85b27fe462996e2d309d056b349b29fec4bf0e8e55cb3f4fcbaeea76"
      ]
    },
    {
      "rule_id": "C04",
      "machine_key": "document-loop-v1",
      "url": "https://example.org/",
      "outcome": "not_applicable",
      "object_kind": "page",
      "message": "Нет объекта для этого правила в обследованном ответе.",
      "reason_code": "not_applicable",
      "evidence_refs": [
        "9a46a9671fdfa7809d5c5fe677fd723959d59877944617395af3d57db60ebd5f",
        "b9460e0c85b27fe462996e2d309d056b349b29fec4bf0e8e55cb3f4fcbaeea76"
      ]
    },
    {
      "rule_id": "C05",
      "machine_key": "document-downgrade-v1",
      "url": "https://example.org/",
      "outcome": "not_applicable",
      "object_kind": "page",
      "message": "Нет объекта для этого правила в обследованном ответе.",
      "reason_code": "not_applicable",
      "evidence_refs": [
        "9a46a9671fdfa7809d5c5fe677fd723959d59877944617395af3d57db60ebd5f",
        "b9460e0c85b27fe462996e2d309d056b349b29fec4bf0e8e55cb3f4fcbaeea76"
      ]
    },
    {
      "rule_id": "C06",
      "machine_key": "form-action-v1",
      "url": "https://example.org/",
      "outcome": "fail",
      "object_kind": "page",
      "message": "В полученном статическом HTML задан HTTP-адрес отправки формы; форма не отправлялась.",
      "reason_code": "fail",
      "evidence_refs": [
        "9a46a9671fdfa7809d5c5fe677fd723959d59877944617395af3d57db60ebd5f",
        "b9460e0c85b27fe462996e2d309d056b349b29fec4bf0e8e55cb3f4fcbaeea76"
      ]
    },
    {
      "rule_id": "C07",
      "machine_key": "document-empty-v1",
      "url": "https://example.org/",
      "outcome": "not_applicable",
      "object_kind": "page",
      "message": "Нет объекта для этого правила в обследованном ответе.",
      "reason_code": "not_applicable",
      "evidence_refs": [
        "9a46a9671fdfa7809d5c5fe677fd723959d59877944617395af3d57db60ebd5f",
        "b9460e0c85b27fe462996e2d309d056b349b29fec4bf0e8e55cb3f4fcbaeea76"
      ]
    },
    {
      "rule_id": "C01",
      "machine_key": "protocol-page-v1",
      "url": "https://example.org/policy",
      "outcome": "not_applicable",
      "object_kind": "document",
      "message": "Нет объекта для этого правила в обследованном ответе.",
      "reason_code": "not_applicable",
      "evidence_refs": [
        "6bc89e213565e99b4367b18cd26751784247a2f206c630a0d761de9ad75a676b",
        "d3ecba4bb0850118d2dba9334143fd8f60a5ae0b251821bc2d8a0f271067034b"
      ]
    },
    {
      "rule_id": "C02",
      "machine_key": "tls-certificate-v1",
      "url": "https://example.org/policy",
      "outcome": "pass",
      "object_kind": "document",
      "message": "Техническое условие проверено; дефект не обнаружен.",
      "reason_code": "pass",
      "evidence_refs": [
        "6bc89e213565e99b4367b18cd26751784247a2f206c630a0d761de9ad75a676b",
        "d3ecba4bb0850118d2dba9334143fd8f60a5ae0b251821bc2d8a0f271067034b"
      ]
    },
    {
      "rule_id": "C03",
      "machine_key": "document-status-v1",
      "url": "https://example.org/policy",
      "outcome": "fail",
      "object_kind": "document",
      "message": "В HTTP-проверке конкретная ссылка на документ возвращает 404.",
      "reason_code": "fail",
      "evidence_refs": [
        "6bc89e213565e99b4367b18cd26751784247a2f206c630a0d761de9ad75a676b",
        "d3ecba4bb0850118d2dba9334143fd8f60a5ae0b251821bc2d8a0f271067034b"
      ]
    },
    {
      "rule_id": "C04",
      "machine_key": "document-loop-v1",
      "url": "https://example.org/policy",
      "outcome": "pass",
      "object_kind": "document",
      "message": "Техническое условие проверено; дефект не обнаружен.",
      "reason_code": "pass",
      "evidence_refs": [
        "6bc89e213565e99b4367b18cd26751784247a2f206c630a0d761de9ad75a676b",
        "d3ecba4bb0850118d2dba9334143fd8f60a5ae0b251821bc2d8a0f271067034b"
      ]
    },
    {
      "rule_id": "C05",
      "machine_key": "document-downgrade-v1",
      "url": "https://example.org/policy",
      "outcome": "pass",
      "object_kind": "document",
      "message": "Техническое условие проверено; дефект не обнаружен.",
      "reason_code": "pass",
      "evidence_refs": [
        "6bc89e213565e99b4367b18cd26751784247a2f206c630a0d761de9ad75a676b",
        "d3ecba4bb0850118d2dba9334143fd8f60a5ae0b251821bc2d8a0f271067034b"
      ]
    },
    {
      "rule_id": "C06",
      "machine_key": "form-action-v1",
      "url": "https://example.org/policy",
      "outcome": "not_applicable",
      "object_kind": "document",
      "message": "Нет объекта для этого правила в обследованном ответе.",
      "reason_code": "not_applicable",
      "evidence_refs": [
        "6bc89e213565e99b4367b18cd26751784247a2f206c630a0d761de9ad75a676b",
        "d3ecba4bb0850118d2dba9334143fd8f60a5ae0b251821bc2d8a0f271067034b"
      ]
    },
    {
      "rule_id": "C07",
      "machine_key": "document-empty-v1",
      "url": "https://example.org/policy",
      "outcome": "inconclusive",
      "object_kind": "document",
      "message": "Две попытки не дали согласованного результата: different_or_unavailable_observations",
      "reason_code": "inconsistent_or_unavailable",
      "evidence_refs": [
        "6bc89e213565e99b4367b18cd26751784247a2f206c630a0d761de9ad75a676b",
        "d3ecba4bb0850118d2dba9334143fd8f60a5ae0b251821bc2d8a0f271067034b"
      ]
    }
  ],
  "findings": [
    {
      "finding_id": "sha256:5e9886ebeb1b616fe6bf",
      "rule_id": "C06",
      "url": "https://example.org/",
      "fact": "В полученном статическом HTML задан HTTP-адрес отправки формы; форма не отправлялась.",
      "technical_severity": "medium",
      "color": "yellow",
      "recommendation": "Проверьте action/formaction и фактическую обработку формы; используйте HTTPS.",
      "reference": "Справочно: 152-ФЗ, статьи 18.1 и 19. Юридическая квалификация не выполняется.",
      "legal_verdict": null,
      "evidence_refs": [
        "9a46a9671fdfa7809d5c5fe677fd723959d59877944617395af3d57db60ebd5f",
        "b9460e0c85b27fe462996e2d309d056b349b29fec4bf0e8e55cb3f4fcbaeea76"
      ]
    },
    {
      "finding_id": "sha256:9a0dd39d5acac38f5bf2",
      "rule_id": "C03",
      "url": "https://example.org/policy",
      "fact": "В HTTP-проверке конкретная ссылка на документ возвращает 404.",
      "technical_severity": "medium",
      "color": "yellow",
      "recommendation": "Исправьте конкретную ссылку либо восстановите доступ к документу.",
      "reference": "Справочно: 152-ФЗ, статьи 18.1 и 19. Юридическая квалификация не выполняется.",
      "legal_verdict": null,
      "evidence_refs": [
        "6bc89e213565e99b4367b18cd26751784247a2f206c630a0d761de9ad75a676b",
        "d3ecba4bb0850118d2dba9334143fd8f60a5ae0b251821bc2d8a0f271067034b"
      ]
    }
  ],
  "inventory": {
    "documents": [
      {
        "url": "https://example.org/policy",
        "source": "https://example.org/",
        "label": "политика конфиденциальности",
        "explicit": true
      }
    ],
    "forms": [
      {
        "page": "https://example.org/",
        "index": 0,
        "method": "get",
        "fields": [
          {
            "type": "email",
            "name": null
          }
        ],
        "action": "http://example.org/sha256:27ce1d1bf4270020e179",
        "formaction": []
      }
    ],
    "cookies": [],
    "external_hosts": []
  },
  "evidence": {
    "9a46a9671fdfa7809d5c5fe677fd723959d59877944617395af3d57db60ebd5f": {
      "sha256": "9a46a9671fdfa7809d5c5fe677fd723959d59877944617395af3d57db60ebd5f",
      "data": {
        "url": "https://example.org/",
        "final": "https://example.org/",
        "at": "2026-10-14T13:22:25.689248+00:00",
        "attempt": 1,
        "status": 200,
        "error": "",
        "tls_code": null,
        "chain": [
          {
            "url": "https://example.org/",